{
  "apiVersion": "glt.dev/v1alpha1",
  "kind": "TopologySnapshot",
  "snapshot_id": "snap-bootstrap-golden-001",
  "as_of": "2026-08-14T10:00:00Z",
  "registry_version": "0.2.0",
  "boundary_id": "glt.bootstrap-slice@1",
  "pinned_to": {
    "git_sha": "5c90ac44026a35701a8b32c14c99c8958ea3c83e",
    "artifact_digest": "sha256:754b1bf6adb435bd4f80e6bf0b5b253765b34601dd92aca6320cecfcec2a19a4"
  },
  "source_digests": {
    "boundary": "sha256:59c61ef3318b997bf48ab177c169d6e23e0863079d319cd63866a1ffcb0326fa",
    "propagation_matrix": "sha256:0553cb81f5c868642b9057b0ad492ecd5a7578b5fd426ff5c0c2031bf392ad61",
    "registry": "sha256:754b1bf6adb435bd4f80e6bf0b5b253765b34601dd92aca6320cecfcec2a19a4"
  },
  "collector_versions": {
    "intent": "1.0.0",
    "registry": "1.0.0"
  },
  "nodes": [
    {
      "apiVersion": "glt.dev/v1alpha1",
      "kind": "Node",
      "metadata": {
        "id": "glt.controlplane.check",
        "revision": 1,
        "namespace": "glt.controlplane",
        "title": "Bootstrap Invariant Check",
        "aliases": [
          "⟁CHK"
        ]
      },
      "spec": {
        "type": "check",
        "lifecycle": "planned",
        "owner": "engineering",
        "criticality": "high",
        "sensitivity": "internal",
        "capabilities": [
          "glt.check.invariants"
        ],
        "signals": [],
        "sources": [
          {
            "repository": "glt-controlplane",
            "path": "glt-specpack/docs/SPEC/invariants.md",
            "authority": "engineering-contract",
            "role": "contract"
          }
        ],
        "delivery": {
          "expectedFromStep": "glt.dev.02",
          "gate": "glt.controlplane.gate.bootstrap",
          "status": "planned"
        }
      }
    },
    {
      "apiVersion": "glt.dev/v1alpha1",
      "kind": "Node",
      "metadata": {
        "id": "glt.controlplane.compiler",
        "revision": 1,
        "namespace": "glt.controlplane",
        "title": "Snapshot Compiler",
        "aliases": [
          "⟁COMP"
        ]
      },
      "spec": {
        "type": "tool",
        "lifecycle": "planned",
        "owner": "engineering",
        "criticality": "high",
        "sensitivity": "internal",
        "capabilities": [
          "glt.snapshot.compile"
        ],
        "signals": [],
        "sources": [
          {
            "repository": "glt-controlplane",
            "path": "glt-specpack/docs/SPEC/snapshots.md",
            "authority": "engineering-contract",
            "role": "contract"
          }
        ],
        "delivery": {
          "expectedFromStep": "glt.dev.08",
          "gate": "glt.controlplane.gate.bootstrap",
          "status": "planned"
        }
      }
    },
    {
      "apiVersion": "glt.dev/v1alpha1",
      "kind": "Node",
      "metadata": {
        "id": "glt.controlplane.gate.bootstrap",
        "revision": 1,
        "namespace": "glt.controlplane",
        "title": "Bootstrap Pre-code Gate",
        "aliases": [
          "⟁GATE"
        ]
      },
      "spec": {
        "type": "gate",
        "lifecycle": "planned",
        "owner": "governance",
        "criticality": "critical",
        "sensitivity": "internal",
        "capabilities": [],
        "signals": [],
        "sources": [
          {
            "repository": "glt-controlplane",
            "path": "glt-specpack/docs/00-governance/pre-code-gate.md",
            "authority": "governance-normativity",
            "role": "contract"
          }
        ],
        "delivery": {
          "expectedFromStep": "glt.dev.09",
          "gate": "glt.controlplane.gate.bootstrap",
          "status": "planned"
        }
      }
    },
    {
      "apiVersion": "glt.dev/v1alpha1",
      "kind": "Node",
      "metadata": {
        "id": "glt.controlplane.registry.entry",
        "revision": 1,
        "namespace": "glt.controlplane",
        "title": "Registry Entry",
        "aliases": [
          "⟁REG"
        ]
      },
      "spec": {
        "type": "domain",
        "lifecycle": "planned",
        "owner": "registry",
        "criticality": "high",
        "sensitivity": "internal",
        "capabilities": [],
        "signals": [],
        "sources": [
          {
            "repository": "glt-controlplane",
            "path": "glt-specpack/docs/SPEC/registry.md",
            "authority": "glt-id-registry",
            "role": "contract"
          }
        ],
        "delivery": {
          "expectedFromStep": "glt.dev.06",
          "gate": "glt.controlplane.gate.bootstrap",
          "status": "planned"
        }
      }
    }
  ],
  "edges": [
    {
      "apiVersion": "glt.dev/v1alpha1",
      "kind": "Edge",
      "metadata": {
        "id": "glt.edge.check-validates-compiler"
      },
      "spec": {
        "from": "glt.controlplane.check",
        "to": "glt.controlplane.compiler",
        "relation": "validates",
        "assertions": [
          {
            "plane": "intended",
            "status": "asserted",
            "evidence": {
              "repository": "glt-controlplane",
              "path": "glt-specpack/docs/SPEC/gates.md",
              "authority": "engineering-contract",
              "role": "derived-from"
            }
          },
          {
            "plane": "materialized",
            "status": "not_observed",
            "evidence": null
          },
          {
            "plane": "observed",
            "status": "not_observed",
            "evidence": null
          }
        ],
        "propagation": {
          "change": [
            "behavior",
            "content",
            "interface",
            "schema"
          ],
          "incident": []
        }
      }
    },
    {
      "apiVersion": "glt.dev/v1alpha1",
      "kind": "Edge",
      "metadata": {
        "id": "glt.edge.compiler-depends-registry"
      },
      "spec": {
        "from": "glt.controlplane.compiler",
        "to": "glt.controlplane.registry.entry",
        "relation": "depends_on",
        "assertions": [
          {
            "plane": "intended",
            "status": "asserted",
            "evidence": {
              "repository": "glt-controlplane",
              "path": "glt-specpack/docs/SPEC/snapshots.md",
              "authority": "engineering-contract",
              "role": "derived-from"
            }
          },
          {
            "plane": "materialized",
            "status": "not_observed",
            "evidence": null
          },
          {
            "plane": "observed",
            "status": "not_observed",
            "evidence": null
          }
        ],
        "propagation": {
          "change": [
            "dependency",
            "interface",
            "schema"
          ],
          "incident": [
            "availability"
          ]
        }
      }
    },
    {
      "apiVersion": "glt.dev/v1alpha1",
      "kind": "Edge",
      "metadata": {
        "id": "glt.edge.gate-gates-check"
      },
      "spec": {
        "from": "glt.controlplane.gate.bootstrap",
        "to": "glt.controlplane.check",
        "relation": "gates",
        "assertions": [
          {
            "plane": "intended",
            "status": "asserted",
            "evidence": {
              "repository": "glt-controlplane",
              "path": "glt-specpack/docs/00-governance/pre-code-gate.md",
              "authority": "governance-normativity",
              "role": "derived-from"
            }
          },
          {
            "plane": "materialized",
            "status": "not_observed",
            "evidence": null
          },
          {
            "plane": "observed",
            "status": "not_observed",
            "evidence": null
          }
        ],
        "propagation": {
          "change": [],
          "incident": []
        }
      }
    }
  ],
  "config_profile": "bootstrap",
  "matrix_version": "1.0.0",
  "digest": "sha256:5bca8f91f0a92a6ae60dc83515810b388b809649101f76a500d235a490c65b41"
}
